{
 "schema": "fdo-consume-binding/5",
 "object": {
  "pid": "https://example.org/stand-in/hamburg-cca-profile-demo",
  "identifier": "https://example.org/stand-in/hamburg-cca-profile-demo",
  "crate_sha256": "4240fc93589a74f70950814d8426e8ecbadd11edda2fca646cb79ade1be57f60",
  "name": "Hamburg urban pluvial flood risk and social vulnerability: HEALPix cell products (demo)",
  "description": "Two public map products of the urban-pfr toolbox for Hamburg, aggregated to HEALPix equal-area cells, with the three statements of the underlying study referenced from their Knowledge Loom record. All data values and associated test metadata are synthetic.",
  "date": "2026-10-07",
  "licence": "https://creativecommons.org/licenses/by/4.0/",
  "profiles": [
   "https://w3id.org/cc-crate-profile/0.9"
  ],
  "map": "cca-crate-0.9",
  "overlay": "cca-dashboard-proposal-2026-09",
  "fields": {
   "title": "Hamburg urban pluvial flood risk and social vulnerability: HEALPix cell products (demo)",
   "description": "Two public map products of the urban-pfr toolbox for Hamburg, aggregated to HEALPix equal-area cells, with the three statements of the underlying study referenced from their Knowledge Loom record. All data values and associated test metadata are synthetic.",
   "licence": "https://creativecommons.org/licenses/by/4.0/",
   "date": "2026-10-07",
   "identifier": "https://example.org/stand-in/hamburg-cca-profile-demo",
   "profile": "https://w3id.org/cc-crate-profile/0.9",
   "keywords": [],
   "type": [],
   "author": [
    "Test fixture builder (synthetic object)"
   ],
   "status": "demo: synthetic values; no PID minted yet",
   "access_rights": null,
   "conditions_of_access": null,
   "policy": null
  },
  "access": {
   "state": "unknown",
   "rights": [],
   "conditions": [],
   "policy": null,
   "requires_authorization": null
  }
 },
 "consumer": {
  "contract": "cs3-map-v1",
  "compatibility": {
   "status": "PASS",
   "evidence": [
    "A7",
    "A4"
   ],
   "diagnostics": []
  }
 },
 "entities": [
  {
   "id": "#product-risk-healpix",
   "type": "Dataset",
   "provides": [],
   "holders": [],
   "pid": "https://example.org/stand-in/product/risk-healpix",
   "profiles": [],
   "fields": {
    "name": "PFR risk, HEALPix equal-area cells (public)",
    "description": "Bivariate pluvial flood risk (mobility/accessibility x well-being) per HEALPix cell.",
    "identifier": "https://example.org/stand-in/product/risk-healpix",
    "data_collector": null,
    "origin": null,
    "nature": null,
    "scale": "#place-hamburg-extent",
    "sensitivity": null,
    "format": null,
    "access_rights": "http://publications.europa.eu/resource/authority/access-right/PUBLIC",
    "conditions_of_access": "open; no registration",
    "policy": null,
    "spatial_box": "53.395907 9.736497 53.71725 10.312797"
   },
   "access": {
    "state": "open",
    "rights": [
     "http://publications.europa.eu/resource/authority/access-right/PUBLIC"
    ],
    "conditions": [
     "open; no registration"
    ],
    "policy": null,
    "requires_authorization": false
   }
  },
  {
   "id": "#product-vulnerability-healpix",
   "type": "Dataset",
   "provides": [],
   "holders": [],
   "pid": "https://example.org/stand-in/product/vulnerability-healpix",
   "profiles": [],
   "fields": {
    "name": "Social vulnerability, HEALPix equal-area cells (public)",
    "description": "Social vulnerability (SVPF, SVI) and its drivers (sensitivity, coping capacity) per HEALPix cell.",
    "identifier": "https://example.org/stand-in/product/vulnerability-healpix",
    "data_collector": null,
    "origin": null,
    "nature": null,
    "scale": "#place-hamburg-extent",
    "sensitivity": null,
    "format": null,
    "access_rights": "http://publications.europa.eu/resource/authority/access-right/PUBLIC",
    "conditions_of_access": "open; no registration",
    "policy": null,
    "spatial_box": "53.395907 9.736497 53.71725 10.312797"
   },
   "access": {
    "state": "open",
    "rights": [
     "http://publications.europa.eu/resource/authority/access-right/PUBLIC"
    ],
    "conditions": [
     "open; no registration"
    ],
    "policy": null,
    "requires_authorization": false
   }
  },
  {
   "id": "#product-buildings-risk",
   "type": "Dataset",
   "provides": [],
   "holders": [],
   "pid": "https://example.org/stand-in/product/buildings-risk",
   "profiles": [],
   "fields": {
    "name": "Buildings with risk, building level (restricted; metadata only)",
    "description": "Building-level risk values. Not distributed in this crate: restricted, and no access route exists yet for this product.",
    "identifier": "https://example.org/stand-in/product/buildings-risk",
    "data_collector": null,
    "origin": null,
    "nature": null,
    "scale": null,
    "sensitivity": null,
    "format": null,
    "access_rights": "http://publications.europa.eu/resource/authority/access-right/RESTRICTED",
    "conditions_of_access": "building-level data; access on request for academic research; policy not yet published",
    "policy": null,
    "spatial_box": null
   },
   "access": {
    "state": "restricted",
    "rights": [
     "http://publications.europa.eu/resource/authority/access-right/RESTRICTED"
    ],
    "conditions": [
     "building-level data; access on request for academic research; policy not yet published"
    ],
    "policy": null,
    "requires_authorization": true
   }
  },
  {
   "id": "#var-PFRMA_smoothed",
   "type": "Variable",
   "provides": [],
   "holders": [
    "#product-risk-healpix",
    "#product-buildings-risk"
   ],
   "pid": null,
   "profiles": [],
   "fields": {
    "name": "PFRMA_smoothed",
    "url": null,
    "property_id": "https://example.org/stand-in/variable/risk_mobility_accessibility",
    "unit_code": "http://qudt.org/vocab/unit/UNITLESS",
    "unit_text": "index 0-1",
    "description": "pluvial flood risk, mobility and accessibility (smoothed index)"
   },
   "access": {
    "state": "open",
    "rights": [
     "http://publications.europa.eu/resource/authority/access-right/PUBLIC"
    ],
    "conditions": [
     "open; no registration"
    ],
    "policy": null,
    "requires_authorization": false
   }
  },
  {
   "id": "#var-PFRWB_smoothed",
   "type": "Variable",
   "provides": [],
   "holders": [
    "#product-risk-healpix",
    "#product-buildings-risk"
   ],
   "pid": null,
   "profiles": [],
   "fields": {
    "name": "PFRWB_smoothed",
    "url": null,
    "property_id": "https://example.org/stand-in/variable/risk_wellbeing",
    "unit_code": "http://qudt.org/vocab/unit/UNITLESS",
    "unit_text": "index 0-1",
    "description": "pluvial flood risk, well-being (smoothed index)"
   },
   "access": {
    "state": "open",
    "rights": [
     "http://publications.europa.eu/resource/authority/access-right/PUBLIC"
    ],
    "conditions": [
     "open; no registration"
    ],
    "policy": null,
    "requires_authorization": false
   }
  },
  {
   "id": "#var-HMA",
   "type": "Variable",
   "provides": [],
   "holders": [
    "#product-risk-healpix"
   ],
   "pid": null,
   "profiles": [],
   "fields": {
    "name": "HMA",
    "url": null,
    "property_id": "https://example.org/stand-in/variable/hazard_mobility_accessibility",
    "unit_code": "http://qudt.org/vocab/unit/UNITLESS",
    "unit_text": "index 0-1",
    "description": "hazard index, mobility and accessibility"
   },
   "access": {
    "state": "open",
    "rights": [
     "http://publications.europa.eu/resource/authority/access-right/PUBLIC"
    ],
    "conditions": [
     "open; no registration"
    ],
    "policy": null,
    "requires_authorization": false
   }
  },
  {
   "id": "#var-HWB",
   "type": "Variable",
   "provides": [],
   "holders": [
    "#product-risk-healpix"
   ],
   "pid": null,
   "profiles": [],
   "fields": {
    "name": "HWB",
    "url": null,
    "property_id": "https://example.org/stand-in/variable/hazard_wellbeing",
    "unit_code": "http://qudt.org/vocab/unit/UNITLESS",
    "unit_text": "index 0-1",
    "description": "hazard index, well-being"
   },
   "access": {
    "state": "open",
    "rights": [
     "http://publications.europa.eu/resource/authority/access-right/PUBLIC"
    ],
    "conditions": [
     "open; no registration"
    ],
    "policy": null,
    "requires_authorization": false
   }
  },
  {
   "id": "#var-healpix_id",
   "type": "Variable",
   "provides": [],
   "holders": [
    "#product-risk-healpix",
    "#product-vulnerability-healpix"
   ],
   "pid": null,
   "profiles": [],
   "fields": {
    "name": "healpix_id",
    "url": null,
    "property_id": "https://example.org/stand-in/variable/cell_id",
    "unit_code": "http://qudt.org/vocab/unit/NUM",
    "unit_text": "cell id",
    "description": "HEALPix cell identifier (depth 15)"
   },
   "access": {
    "state": "open",
    "rights": [
     "http://publications.europa.eu/resource/authority/access-right/PUBLIC"
    ],
    "conditions": [
     "open; no registration"
    ],
    "policy": null,
    "requires_authorization": false
   }
  },
  {
   "id": "#var-n_buildings",
   "type": "Variable",
   "provides": [],
   "holders": [
    "#product-risk-healpix",
    "#product-vulnerability-healpix"
   ],
   "pid": null,
   "profiles": [],
   "fields": {
    "name": "n_buildings",
    "url": null,
    "property_id": "https://example.org/stand-in/variable/aggregation_count",
    "unit_code": "http://qudt.org/vocab/unit/NUM",
    "unit_text": "count",
    "description": "number of buildings aggregated into the cell"
   },
   "access": {
    "state": "open",
    "rights": [
     "http://publications.europa.eu/resource/authority/access-right/PUBLIC"
    ],
    "conditions": [
     "open; no registration"
    ],
    "policy": null,
    "requires_authorization": false
   }
  },
  {
   "id": "#var-SVPF",
   "type": "Variable",
   "provides": [],
   "holders": [
    "#product-vulnerability-healpix"
   ],
   "pid": null,
   "profiles": [],
   "fields": {